"Product Name","Link",
"Sharp Air Purifier for Homes & Offices | Dual Purification - ACTIVE (Plasmacluster Technology) & PASSIVE FILTERS (True HEPA H14+Carbon+Pre-Filter) | Captures 99.97% of Impurities | Model:FP-F40E-W | White","/gp/slredirect/picassoRedirect.html/ref=pa_sp_atf_browse_kitchen_sr_pg48_1?ie=UTF8&adId=A0910547J0ZYC5KQF7EY&url=%2FSharp-Purifier-FP-F40E-W-Filter-Cluster%2Fdp%2FB01B0DT29A%2Fref%3Dsr_1_753_sspa%3Fdchild%3D1%26qid%3D1592573765%26s%3Dkitchen%26sr%3D1-753-spons%26psc%3D1&qualifier=1592573765&id=4319399215666909&widgetName=sp_atf_browse"
"Coway Sleek Pro AP-1009 Air Purifier (Pre Filter, Patented Urethane Carbon Filter & Green Anti-flu True HEPA Filter) (Coway AP-1009)","/gp/slredirect/picassoRedirect.html/ref=pa_sp_atf_browse_kitchen_sr_pg48_2?ie=UTF8&adId=A0103506WOS8F4SW7N0G&url=%2FCoway-Sleek-Pro-AP-1009-Purifier%2Fdp%2FB07JZ94F9C%2Fref%3Dsr_1_754_sspa%3Fdchild%3D1%26qid%3D1592573765%26s%3Dkitchen%26sr%3D1-754-spons%26psc%3D1&qualifier=1592573765&id=4319399215666909&widgetName=sp_atf_browse"
"(Renewed) Breathewell PA 600 15-Watt Air Purifier (Grey)","/Renewed-Breathewell-PA-15-Watt-Purifier/dp/B081VLCX58/ref=sr_1_755?dchild=1&qid=1592573765&s=kitchen&sr=1-755"
"Hindware Agnis Air Purifier with True HEPA Filter for Home and Office (White)","/Hindware-Agnis-Purifier-Filter-Office/dp/B081S8VKVX/ref=sr_1_756?dchild=1&qid=1592573765&s=kitchen&sr=1-756"
"Indus Portable Room Air Purifier with HEPA Active Carbon Filter, Humidifier, Ionizer Purifies 99% Harmful Particles from Air (White)","/Portable-Purifier-Humidifier-Purifies-Particles/dp/B081RYHZ3D/ref=sr_1_757?dchild=1&qid=1592573765&s=kitchen&sr=1-757"
"Indus Portable Room Air Purifier with UV Filter Purifies The Air Completely from Active Pollutants (White)","/Portable-Purifier-Purifies-Completely-Pollutants/dp/B081RXVKX4/ref=sr_1_758?dchild=1&qid=1592573765&s=kitchen&sr=1-758"
"CUCKOO Air Purifier A Model, True Hepa 14 Filter, Toxic gas purification. As per Korea Air Cleaning Test Standard Rated area 37.4 Sq.M.","/CUCKOO-Air-Purifier-Model-Ultra/dp/B081FBDRLZ/ref=sr_1_759?dchild=1&qid=1592573765&s=kitchen&sr=1-759"
"Rosette Car Air Purifier (black)","/Rosette-Car-Air-Purifier-black/dp/B081B1J3P3/ref=sr_1_760?dchild=1&qid=1592573765&s=kitchen&sr=1-760"
"Rosette Desk Air Purifier","/Rosette-Desk-Air-Purifier/dp/B0819ZX8VP/ref=sr_1_761?dchild=1&qid=1592573765&s=kitchen&sr=1-761"
"AKDSteel Car Mini Ultrasonic Aromatherapy Humidifier Air Purify Car Air Humidifier White -for auto","/AKDSteel-Ultrasonic-Aromatherapy-Humidifier-Purify/dp/B0817X7S1Z/ref=sr_1_762?dchild=1&qid=1592573765&s=kitchen&sr=1-762"
"TruSens Z-3000 Air Purifier | Remote SensorPod | 360 HEPA Filtration with Dupont Filter | UV Light Sterilization Kills Bacteria Germs Odor Allergens in Home | Dual Airflow for Full Coverage (Large)","/gp/slredirect/picassoRedirect.html/ref=pa_sp_mtf_browse_kitchen_sr_pg48_1?ie=UTF8&adId=A10270163VKRZ9Z7VD3QO&url=%2FTruSens-SensorPod-Filtration-Sterilization-Allergens%2Fdp%2FB07W3NJ8X8%2Fref%3Dsr_1_763_sspa%3Fdchild%3D1%26qid%3D1592573765%26s%3Dkitchen%26sr%3D1-763-spons%26psc%3D1&qualifier=1592573765&id=4319399215666909&widgetName=sp_mtf_browse"
"TruSens Z-1000 Air Purifier | 360 HEPA Filtration with Dupont Filter | UV Light Sterilization Kills Bacteria Germs Odor Allergens in Home | Dual Airflow for Full Coverage (Small)","/gp/slredirect/picassoRedirect.html/ref=pa_sp_mtf_browse_kitchen_sr_pg48_2?ie=UTF8&adId=A0615935EHSOAIPFR57U&url=%2FTruSens-Purifier-Filtration-Sterilization-Allergens%2Fdp%2FB07T91STDY%2Fref%3Dsr_1_764_sspa%3Fdchild%3D1%26qid%3D1592573765%26s%3Dkitchen%26sr%3D1-764-spons%26psc%3D1&qualifier=1592573765&id=4319399215666909&widgetName=sp_mtf_browse"
"BLUE WATER RO+UV+ALKALINE+UF, pH 9.5, ORP-400, LED Indicator, Delta Purifier with 12 L Per Hour Mineral Water Output (White)","/BLUE-WATER-ALKALINE-Indicator-Purifier/dp/B0817W8V5H/ref=sr_1_765?dchild=1&qid=1592573765&s=kitchen&sr=1-765"
"HULLAARDS Hepa Air purifier remove 99.97% airborne pollutants 65 Watt Silver 6 Stage Flitration for Home (AT-21)","/HULLAARDS-purifier-airborne-pollutants-Flitration/dp/B0813WNN67/ref=sr_1_766?dchild=1&qid=1592573765&s=kitchen&sr=1-766"
"HULLAARDS Hepa Air purifier remove 99.97% airborne pollutants 65 Watt Gold 6 Stage Flitration for Home (AT 21)","/HULLAARDS-purifier-airborne-pollutants-Flitration/dp/B0813WBMZ8/ref=sr_1_767?dchild=1&qid=1592573765&s=kitchen&sr=1-767"
"HULLAARDS Hepa FILLO Wifi Air purifier remove 99.97% airborne pollutants 35 Watt white 6 Stage Flitration for Home","/HULLAARDS-FILLO-purifier-pollutants-Flitration/dp/B0813VJL27/ref=sr_1_768?dchild=1&qid=1592573765&s=kitchen&sr=1-768"
"HULLAARDS Hepa HALO Air purifier remove 99.97% airborne pollutants 35 Watt white 6 Stage Flitration for Home","/HULLAARDS-purifier-airborne-pollutants-Flitration/dp/B0813VHHRB/ref=sr_1_769?dchild=1&qid=1592573765&s=kitchen&sr=1-769"
"HULLAARDS Hepa Air purifier remove 99.97% airborne pollutants 35 Watt white 6 Stage Flitration for Home (AT-21)","/HULLAARDS-purifier-airborne-pollutants-Flitration/dp/B0813VCR56/ref=sr_1_770?dchild=1&qid=1592573765&s=kitchen&sr=1-770"
"HULLAARDS Hepa Air purifier remove 99.97% airborne pollutants 80 Watt Silver 6 Stage Flitration for Home (AT-191)","/HULLAARDS-purifier-airborne-pollutants-Flitration/dp/B0813V7MZG/ref=sr_1_771?dchild=1&qid=1592573765&s=kitchen&sr=1-771"
"Philips Air Purifier AC0817/20 Machine","/Philips-Air-Purifier-AC0817-Machine/dp/B0813HY2ZG/ref=sr_1_772?dchild=1&qid=1592573765&s=kitchen&sr=1-772"
"TruSens Z-2000 Air Purifier | Remote SensorPod | 360 HEPA Filtration with Dupont Filter | UV Light Sterilization Kills Bacteria Germs Odor Allergens in Home | Dual Airflow for Full Coverage (Medium)","/gp/slredirect/picassoRedirect.html/ref=pa_sp_btf_browse_kitchen_sr_pg48_1?ie=UTF8&adId=A08587391LE3EE7FP09ZW&url=%2FTruSens-SensorPod-Filtration-Sterilization-Allergens%2Fdp%2FB07W8J3BCW%2Fref%3Dsr_1_773_sspa%3Fdchild%3D1%26qid%3D1592573765%26s%3Dkitchen%26sr%3D1-773-spons%26psc%3D1&qualifier=1592573765&id=4319399215666909&widgetName=sp_btf_browse"
"TruSens Z-2000 Air Purifier + Replacement Carbon Filter (Bundle)","/gp/slredirect/picassoRedirect.html/ref=pa_sp_btf_browse_kitchen_sr_pg48_2?ie=UTF8&adId=A10186963VLD31XEKNKJE&url=%2FTruSens-Z-2000-Purifier-Replacement-Carbon%2Fdp%2FB07Y58YV12%2Fref%3Dsr_1_774_sspa%3Fdchild%3D1%26qid%3D1592573765%26s%3Dkitchen%26sr%3D1-774-spons%26psc%3D1&qualifier=1592573765&id=4319399215666909&widgetName=sp_btf_browse"
